{
  "schemaVersion": 1,
  "exportId": "01ARZ3NDEKTSV4RRFFQ69G5FB7",
  "presentationRevisionId": "01ARZ3NDEKTSV4RRFFQ69G5FB3",
  "artifact": {
    "schemaVersion": 1,
    "artifactId": "01ARZ3NDEKTSV4RRFFQ69G5FAZ",
    "organizationId": "01ARZ3NDEKTSV4RRFFQ69G5FAV",
    "artifactType": "export_pptx",
    "objectKey": "org/01/published/deck.pptx",
    "sha256": "ffffffffffffffffffffffffffffffffffffffffffffffffffffffffffffffff",
    "mimeType": "application/vnd.openxmlformats-officedocument.presentationml.presentation",
    "sizeBytes": 2048,
    "engineVersion": "ppt-master-v4.7.0",
    "fontPackVersion": "fonts-v1",
    "engineProfile": "default-agentic",
    "authoringMode": "agent-authoring",
    "authoringDisclosure": "agent-authored-editable-draft",
    "fallbackReason": null,
    "suggestedFilename": "年度经营复盘.pptx",
    "snapshotId": "01ARZ3NDEKTSV4RRFFQ69G5FB0",
    "presentationRevisionId": "01ARZ3NDEKTSV4RRFFQ69G5FB3",
    "createdAt": "2026-08-16T08:00:00Z"
  },
  "reusedFromArtifactId": null,
  "compilerVersion": "compiler-v1",
  "packageQaReportId": "01ARZ3NDEKTSV4RRFFQ69G5FAZ",
  "createdAt": "2026-08-16T08:00:00Z"
}
